{
  "schema_version":1,"updated":"2026-08-01","tradition_id":"mesopotamian_babylonian","source_edition_id":"babylonian_rochberg_horoscopes_1998_awdl","source_file_sha256":"dd233eb1593135dacf280224288fb16cf3697df48fc9ec0347cc522959dff285","status":"all_birth_note_pages_inspected_no_astronomical_or_judgment_rules_present","tablet_count":4,"birth_record_count":6,
  "tablets":[
    {"text_number":29,"artifact_ids":["BM 64148","82-9-18,4117"],"edition_pages":{"book":"143","pdf":"159"},"birth_records":[{"record_id":"rochberg1998.text29","babylonian_date":"Artaxerxes II year 36, Du'uzu 15","editor_julian_date":"-368","birth_time":"at sunrise","native":null,"textual_status":"preserved"}],"non_birth_annotations":["Addaru 3, year 40: he was a young child(?); this is a later age/status notation, not another birth."],"engine_limits":["No astronomical placements or judgment rule are present.","Do not turn the later young-child(?) notation into a natal prediction."]},
    {"text_number":30,"artifact_ids":["BM 33563","Rm IV 119"],"edition_pages":{"book":"144","pdf":"160"},"birth_records":[{"record_id":"rochberg1998.text30","babylonian_date":"Seleucid Era 19, Tebetu night of the 16th","editor_julian_date":"-292","birth_time":"last part of night","native":"Belsunu, son of Bel-...(?)","textual_status":"partly_preserved"}],"non_birth_annotations":["The object is pierced by a tag hole; the patronymic is damaged."],"engine_limits":["No astronomical placements or judgment rule are present.","Preserve the damaged native name rather than completing it conjecturally."]},
    {"text_number":31,"artifact_ids":["BM 34693","Sp II 180","L* 1465"],"edition_pages":{"book":"145","pdf":"161"},"birth_records":[{"record_id":"rochberg1998.text31","babylonian_date":"Seleucid Era 98, Ululu","editor_julian_date":"-213","birth_time":"not preserved","native":null,"textual_status":"partly_preserved"}],"non_birth_annotations":["A broken Year 120+ day 10+ notation follows, but it does not preserve another birth statement."],"engine_limits":["No astronomical placements or judgment rule are present.","Do not count the later broken date as a second birth."]},
    {"text_number":32,"artifact_ids":["BM 34567","Sp II 39","L* 1469"],"edition_pages":{"book":"146-147","pdf":"162-163"},"birth_records":[{"record_id":"rochberg1998.text32a","babylonian_date":"Seleucid Era 197, Du'uzu(?) or Tasritu, day 9","editor_julian_date":"-114-07-03","birth_time":"before sunrise","native":null,"textual_status":"partly_preserved"},{"record_id":"rochberg1998.text32b","babylonian_date":"Seleucid Era 194, Sabatu night of the 10th","editor_julian_date":"-116-01-30","birth_time":"one-half beru (one hour) before sunrise","native":null,"textual_status":"preserved"},{"record_id":"rochberg1998.text32c","babylonian_date":"Seleucid Era 158, Kislimu night of the 27th","editor_julian_date":"-153-12-27","birth_time":"middle watch","native":null,"textual_status":"preserved"}],"non_birth_annotations":["The first record's month sign permits competing readings noted in the critical apparatus."],"engine_limits":["This tablet contains three distinct births, not one record with three dates.","No astronomical placements or judgment rules are present.","Preserve the first record's month uncertainty."]}
  ]
}
